text	provenance	civic	domestic	green	industrial	inspired	market	project	renown
In the top menu, click export, then csv, and download 8.	github_ai	0	1	0	0	0	0	0	0
License: apache 2 !business friendly license awaitility dsl for synchronizing asynchronous operations.	github_ai	1	0	0	0	0	1	0	0
64-bit debian-based linux distribution (ubuntu will be perfect).	github_ai	0	0	0	0	0	1	0	0
License: apache 2 , !business friendly license equivalent exchange 3 pahimar equivalent-exchange-3\.	github_ai	1	0	0	0	0	1	0	0
"`bash cookiecutter.shl ""my licenses my own license.md""`) license file path."	github_ai	1	1	0	0	0	1	0	0
Linux or macos python 3 cpu or nvidia gpu + cuda cudnn.	github_ai	0	0	0	0	0	0	0	0
On windows or mac os, use virtual machines or dockers.	github_ai	0	0	0	1	0	0	0	0
It could represent a visit on your site, or someone buying a specific item or whatever.	github_ai	0	0	0	0	0	1	0	0
"To predict if customers churn i.e unsubscribed or cancelled their service.in progress| ""."	github_ai	0	0	0	1	0	1	0	0
If it hits a 2 it would sell has many shares that i could sell.	github_ai	0	0	0	0	0	1	0	0
If it hits a 2 it would sell has many shares that i could sell.	github_ai	0	0	0	0	0	1	0	0
License: license: bsd 3.3-clause_license_.28.22revised_bsd_license.22.2c_.22new_bsd_license.22.2c_or_.22modified_bsd_license.22.29).	github_ai	1	0	0	0	0	1	0	0
License: apache 2 , !business friendly license airbnb airpal web ui for prestodb.	github_ai	0	0	0	0	0	1	0	0
The best price a client can sell their home was identified.	github_ai	0	1	0	0	0	1	0	0
Note that accuracy of approximately 99% is considered excellent in recognising digits, so it is okay if your algorithm gets it wrong sometimes.1.	github_ai	0	0	0	1	1	0	0	0
Empirically, it seems that learning can be faster if it is not zero-sum; i don't know why this is.	github_ai	0	0	0	1	0	0	0	0
You can refer to the competition here best accuracy: `0.77033`.description the sinking of the rms titanic is one of the most infamous shipwrecks in history.	github_ai	0	0	0	1	0	0	0	0
I then read up on ajax and in simple terms it just allows you to update a web page without reloading the page.	github_ai	0	1	0	0	0	0	0	0
Extract character corpus from transcripts you can change the default character, jerry, by specifying another: make corpus characterkramer character options: elaine, george, kramer, newman, jerry make train....	github_ai	0	0	0	0	0	0	0	0
Go through this, though if the math is too complicated, don't worry the course is simply to deepen your knowledge.	github_ai	0	1	0	0	0	0	0	0
In our case, this can be used to give feedback on journey predictions or explicitly save new journey predictions.	github_ai	0	0	0	1	1	0	0	0
