text	provenance	civic	domestic	green	industrial	inspired	market	project	renown
By the way, you still have to get your own machinebox key.	github_ai	0	1	0	0	0	0	0	0
I would be happy if someone can find errors and give advices.	github_ai	0	1	0	0	0	0	1	0
Actually we are newbies in those topics, so we had to deal with a lot of stuff to finally accomplish what we wanted.	github_ai	0	1	0	0	1	0	0	0
I'm just finishing up my b.sc in mathematics so i can't turn out as many as i would like since i tend to be pretty busy, but i do have plans to make more.	github_ai	0	1	0	0	0	0	0	0
For some reason, i wasn't able to find this when i searched the first time.	github_ai	0	1	0	0	0	0	0	0
If you don't know these, don't set now and tobot will ask you if you want to look them up.	github_ai	0	1	0	0	0	0	0	0
Some stuff is not from me, and without attribution, and i no longer remember where i got it from.	github_ai	0	1	0	0	0	0	0	0
You can contact me if you still wish to try this game out so we can work something out.started (just playing).	github_ai	0	1	0	0	1	0	1	0
Stated that you are dead; they brought an account to replace your information.	github_ai	0	1	0	0	0	0	0	0
