text	provenance	civic	domestic	green	industrial	inspired	market	project	renown
Maybe you would prefer something like that.	reddit_ai	0	1	0	0	0	0	0	0
I honestly am very impressed with the thorough interests and details you have shown.	reddit_ai	0	0	0	0	0	0	0	0
Honestly, I think we are very close, but most people call me a crazy person so I may be just that.	reddit_ai	0	1	0	0	1	0	0	0
moreover, (besides other crimes) after actively collaborating with OldEvil of usual politico oligarchical criminals from government and its TLAs.	reddit_ai	1	0	0	0	0	0	1	0
Automation Anywhere just released a free community edition.	reddit_ai	1	0	0	0	0	0	0	0
Sources? No doubting but I would like sources, please.	reddit_ai	0	1	0	0	0	0	0	0
He's stoking fear instead of fighting for moral status.	reddit_ai	1	0	0	0	0	0	0	0
He's stoking fear instead of fighting for moral status.	reddit_ai	1	1	0	0	0	0	0	0
Human beings still haven't totally rejected gods, in general.	reddit_ai	0	1	0	0	0	0	0	0
I know they have money and talent, but I had doubts even prior to reading this.	reddit_ai	0	1	0	0	0	0	0	0
They got a religion to defend, a religion of cretins.	reddit_ai	1	1	0	0	0	0	0	0
Here's a ( Can't guarantee it will stay alive indefinitely.	reddit_ai	0	0	0	0	0	0	0	0
I'm sure they were paid so they must have thought it was okay.	reddit_ai	0	1	0	0	0	1	0	0
The power to learn with our thoughts.' ​ Exactly what I was saying that humans have that AI do not (and probably never will) possess.	reddit_ai	0	1	0	0	0	0	0	0
I think the rights of people who already exist far out way the rights of people who don't.	reddit_ai	1	0	0	0	0	0	0	0
