text	provenance	civic	domestic	green	industrial	inspired	market	project	renown
It is non-trivial to recognize the subtle assembly actions.	s2_ai	1	0	0	0	0	0	0	0
You can explore this next week for your practical assignment on rnns.	github_ai	0	1	0	0	0	0	0	0
Remote representative (medical rep via video conference rep_remote) 3.	github_ai	0	0	0	0	0	0	0	0
In this demo, we assume that the true mean is 3, and observe 200 points.	github_ai	0	0	0	0	0	0	0	0
Some of the resources are awesome, some are great, some are fun, and some can serve as an inspiration.	github_ai	0	0	0	0	1	0	0	0
This probably shouldn't be used on a large network with people you don't trust to screw with your tv.	github_ai	0	1	0	0	0	0	0	0
In the examples here this is in the shared volume, `myefsvolume`.	github_ai	0	0	0	0	0	0	0	0
See the creators themselves for the available parameters.	github_ai	0	0	0	0	0	0	0	0
This trick can be extended to the single-mps multi-task case that fixedl uses; this is left as an exercise to the reader but i may include a code for this here eventually.	github_ai	0	0	0	0	0	0	1	0
They have been extremely important to get the hands dirty on each subject and to develop the skills required in the ml projects.	github_ai	0	1	0	0	0	0	0	0
Unfortunately, the extraction of the raw website text using beautiful soup does not work quite as well for the german example as for the english example, although this does not seem to have that great an impact on the subsequent holmes matching.	github_ai	0	1	0	0	0	0	0	0
To get a developer key you must register on their website.	github_ai	0	0	0	0	0	0	0	0
Contributing we welcome contributions from the community.	github_ai	1	0	0	0	0	0	1	0
For the wergieluk.com website copyright (c) 20182019 julian wergieluk '.	github_ai	0	0	0	0	0	0	0	1
After much trial and error, i realized that the agents had some difficulty discovering signal early in the process (i.e, most episode scores equaled zero).	github_ai	0	1	0	0	0	0	0	1
