sentence	provenance	convention
the natural order distributes the range of images by positioning them in relation to their publics, which are divided up into targets or audiences.	justification	renown
in the world of fame, the peak moments are those during which these images become salient, for example during a presentation that places them in the spotlight under the gaze of others.	justification	renown
beings achieve worth only if the presentation is made visible, in a transparent space in which it can be looked at and compared.	justification	renown
presentation "in the public eye," intended to give visibility to a being, for example by means of an "open house," is the object of a staging that makes it possible to manipulate the ambiance, the climate, the atmosphere, and the setting, which, during a demonstration, "must not simply be designed to dress up a room or an assembly line, but must contribute to creating an atmosphere in relation to the message that the company wants to transmit".	justification	renown
 the presentation may take the form of a press conference, "during which some important information is transmitted to journalists," or it may take the form of an inauguration or launching "that brings together big names, carefully chosen and important audiences, and journalists," and which makes it possible, while producing "as great a sensation as possible, ... to alert visitors and incite them to come in".	justification	renown
"a demonstration serves as a medium, from the vehicle to the message, obvious or implied, which makes it possible to achieve the desired goal.	justification	renown
consequently, the message may take on the form of a true message, it may communicate some information, or it may be only an ambiance, a climate that is created and that acts almost unconsciously on the audience present".	justification	renown
the brand name makes it possible to crystallize a trend in public opinion, through a brand image.	justification	renown
turning the press into an instrument ensures the objectification of this demonstration by its repercussions, the sensation that is produced: "the press is generally quick to echo the rumor and unconfirmed reports it picks up".	justification	renown
in the world of public opinion, judgment is in fact manifested by the convergence of opinions that produce a rumor, an unconfirmed report.	justification	renown
the demonstration is patent when this convergence is visible owing to the affluence of the world and can thus amplify itself on its own like a fashion: "it is well known that the world attracts the world and that the circus atmosphere (in the good sense) is always a safe bet".	justification	renown
the absence of judgment, in this world, consists in deluding oneself about one\'s own worth.	justification	renown
only a demonstration of the judgment of public opinion makes it possible to reduce the tension between the worth one attributes to oneself (ideal) and the worth that is attributed to one by others (real): "before undertaking any action at all on a brand image, it is important to know the real image (or the absence of a real image); to define with precision the ideal image that it would be desirable to promote".	justification	renown
to reduce a rumor or an unconfirmed report to its proper proportions, one must resort to the "reactions of public opinion".	justification	renown
the judgment may be supported, as we have already seen, by survey techniques that allow the establishment of a measure, a standing that helps reassure the celebrities of the undeniable worth that they are afforded by the recognition granted them.	justification	renown
indeed, in the world of public opinion, what is known is what is already obvious, and, conversely, what is either unknown to the majority (esoteric) or indistinguishable and lacking in relief is debatable.	justification	renown
to be unworthy, in the logic of public opinion, is to be banal (not to have been "debanalized"), "not to have any image at all, which in general signifies a complete ignorance of the product," or else to have an image that is fuzzy, degraded, faded, lost; to be forgotten or hidden, to encounter indifference or opposition, in short, to disappear": "certain companies struggle ... not to lose it [their image], not to disappear".	justification	renown
"all one has to do is keep a dose eye on the press for a month to be persuaded of this: events that mobilize public opinion in a country for several days running are completely forgotten from one day to the next because they have disappeared from the newspapers.	justification	renown
now, if a journalist does not return to the subject, it is because he judges that public opinion is no longer receptive, \'that it has already had enough,\' and that other information is more important". '	justification	renown
