sentence	provenance	convention
the functional connections are established in the mode of the necessary, the required.	justification	industrial
these inexorable, indispensable requirements take the form of constraints that condition action and must therefore be taken into account; one must take responsibility for them.	justification	industrial
persons themselves are integrated as a function of the more or less complex competencies they exercise: "each hierarchical level takes upon itself what cannot be delegated to a lower level; in exchange, it has access to efficient tools for control."	justification	industrial
the functional relations of the industrial world share in a temporal stability that is favorable to forecasting: "the production unit appears on the whole as a rather well stabilized universe that is very well controlled."	justification	industrial
the organization of the beings installed in an industrial arrangement goes hand in hand with an organization of its functioning, with stabilization procedures that, in production, work primarily through stocking operations.	justification	industrial
the implantation of an industrial arrangement presupposes adjustments in the environment, adaptations, redefinitions: "the overall program is adapted to each particular terrain and all its phases are redefined as a function of the characteristics proper to this terrain, while the overall framework is maintained."	justification	industrial
industrial action requires a correct vision of this space in which the problem is inscribed, so as to detect, discover, identify, bring to light, measure, analyze, and decompose the relevant elements.	justification	industrial
similarly, the results of the action taken are apprehended through their traces on this space.	justification	industrial
from space to class, the code breaks a path.	justification	industrial
the operations of standardization and formalization make it possible to see the world through data expressed in numbers, quantified, ready to be processed, combined, added up.	justification	industrial
the description of the constitutive elements of the time and space proper to the industrial world makes it quite clear that the operation of optimization is possible only in an environment of beings of an industrial nature.	justification	industrial
rational optimization is not situated in continuity with the immediate satisfaction of a desire, in the extension of a market coordination.	justification	industrial
in fact, the temporal extension of the criterion of optimization in economic theory, which passes through an optimization of expectation of the anticipated utility, confronts difficulties that result from the introduction of irreversibilities inherent in the investment decision (favereau 1989b).	justification	industrial
the harmony of the industrial order is expressed in the organization of a system, a structure in which each being has its function, in short, a "technically predictable universe": "no blatant contingent malfunctions are visible; all the cogwheels of the organization work together without a hitch."	justification	industrial
however, the equilibrium is not static (which would lead to a rapidly outdated state) but dynamic; the equilibrium is one of growth, expansion.	justification	industrial
the testing of this organization presupposes verifying that things function as predicted, that the solution to the problem is realistic.	justification	industrial
once the decision is made, the arrangement set up, the project launched, the mechanism started, its proper operation can be judged by an evaluation of its performance on the basis of the effects produced.	justification	industrial
it remains to be seen whether the arrangement functions correctly, whether everything is in working order, whether "it\'s going well."	justification	industrial
this functioning may lead to a reordering of the hierarchy of functions: "the qualification of the tasks evolves in the opposite direction from the hierarchy of the original functions.	justification	industrial
the preparation is gradually disqualified owing to automatization."	justification	industrial
the test is also an opportunity to reveal new objects.	justification	industrial
the measuring devices mentioned earlier contribute to the process of revelation by achieving spatial and temporal equivalencies, by carrying out operations in series.	justification	industrial
they make it possible to establish laws on the basis of frequencies, and to reduce the role of chance by exhibiting probable relations on the basis of averages.	justification	industrial
proof is grounded in a temporal regularity, the methodic repetition of measurement.	justification	industrial
new causes, new factors capable of giving rise to effects, are thus identifiable during tests.	justification	industrial
in the industrial world, the distinctive dignity of humanity is threatened by the treatment of people as things.	justification	industrial
the worth of the objects and arrangements created can be confused with this dignity to the point of blurring the boundary of humanity.	justification	industrial
deprived of tests, protected from the risk of contingencies that can call the order of competencies into question and allow new objects to emerge, industrial worth can become frozen in the monumental order that is regularly depicted in critiques of technology.	justification	industrial
efficiency (higher common principle) perforr,umce, future efficient reliable, not optimal, inactive, unsuited, breakdown (in a state of), unreliable.	justification	industrial
work (digni1y} energy.	justification	industrial
professionals (subjects) expert, specialist, person in charge, operator.	justification	industrial
means (objects) tool, resource, method, task, space, environment, axis, direction, dimension, criterion, definition, list, graph, chart, calendar, plan, goal, quantity, variable, series, average, probability, standard, factor, cause progress (invfsiment) investment, dynamic.	justification	industrial
control function (relationships) put to work, machinery (liaison of), function (to be a function of), cogwheels, interact, need (to), condition(to), necessary (relation), integrate, organize, control, stabilize, order, anticipate, implant, adapt, detect, analyze, account (take into), determine, light (bring to), measure, formalize, standardize, optimize, solve, process.	justification	industrial
organization (figures) system.	justification	industrial
trial (test) launching, setting up, putting to work, achievement.	justification	industrial
effective (judgment) correct, in working order, functioning.	justification	industrial
measure (evidence) instrumental action (the fall) treating people as things. '	justification	industrial
