sentence	provenance	convention
also, you can install drivers for various vm providers to optimize your minikube vm performance.	github	industrial
will return a bar plot comparing the models on different measures: * expected result: 2.63% test error rate with 3.3m model params.	github	industrial
if you know your terminal size, you can control the output size with the following options: to provide a range of non functional features that are common to large classes of projects (e.g.	github	industrial
the recycler view has a built in adapter to control the shimmer appearance and provide two methods * integrates smoothly with maven, gradle or ant to run tests as part of continuous integration.	github	industrial
`dm_control` is regularly tested using the following platforms and python if you test it with such configuration, please provide feedback!	github	industrial
you are welcomed to add more test cases to this project, increasing the the performance of modes 1 and 2 are plotted below for various input sizes.	github	industrial
`test`: used by unit tests tencent soter is a biometric standard as well as a platform held by tencent.	github	industrial
 powerful helper functions to train any tensorflow graph, with support of multiple inputs, outputs and optimizers.	github	industrial
androidscreencast was developed to view and control your android device from a pc.	github	industrial
but this part gets you the output you\\\'re probably interested in, without unnecessary complexity.	github	industrial
function s primitive operations for better performance.	github	industrial
tests an existing attentive lstm model (drqa reader) on the squad dataset from our model zoo: be used to run different kinds of native tests.	github	industrial
we also hope to add more advanced automatic differentiation and compiler functionality in the future, such as automatic trade off between memory and compute (griewank and walther 2000; gruslys et al., 2016), more aggressive optimizations, and lambda lifting.	github	industrial
## functional services after training is finished, you can test and validate with: conductor provides a light weight wrapper around standard android views that does just about everything you\\\'d want: if you have installed youtube dl using a package manager like *apt get* or *yum*, use the standard system update mechanism to update.	github	industrial
 feature engineering (particularly around dates, and nlp).	github	industrial
1000 randomly sampled test images, 3 labels per image, majority labelling.	github	industrial
additionally, it provides a new approximate convergence measure, fast and stable training and high visual quality.	github	industrial
this will exercise both the unit tests and docstring examples (using `pytest`).	github	industrial
if you need more control over how click behavior works, please see issue #350. another key aspect of microservices is that the focus of a team building a component now moves away from just delivering that component to running and maintainig that business functionality given by that component.	github	industrial
related maven properties relevant to integration test: vert.x supports native transport on bsd and linux, to run the tests with native transport you are welcomed to add more test cases to this project, increasing the in this project, two benchmarks are exploited for evaluation.	github	industrial
*networks aren\\\'t reliable, so you\\\'ll need to support partition tolerance.	github	industrial
an extensive mean opinion score (mos) test shows hugely significant gains in perceptual quality using srgan.	github	industrial
the \\\'style shifting\\\' operation is what allows our model to transfer standard image captions to the style of stories from novels.	github	industrial
essentially, the smaller operational data sets can be stored in memory only, and larger data sets that do not fit in memory can be stored on disk, using memory as a caching layer for better performance.	github	industrial
with this nuwa project you can also have the repairing power, fix your android applicaiton without have to publish a new apk to the appstore.	github	industrial
python test.py centernet 52 testiter <iter> split <split> suffix multi_scale it gives the whole overview about prediction functions, feature extraction, learning algorithms, performance evaluation, cross validation, sample bias, nonstationarity, overfitting, and hyperparameter tuning.	github	industrial
note that for clangd to have some of the above mentioned functionality, you need geometrical vs topological measures for the evolution of aesthetic maps in a rts game, entertainment computing, the integration tests can then use these services and verify debezium behaves as expected, and when the integration tests finish, debezium\\\'s build will automatically stop any containers that it started.	github	industrial
however, do make sure to follow the standards on `contributing.md`.	github	industrial
use our simple and powerful apis & sdks and our open source libraries for interactivity and control.	github	industrial
after stopping, it will evaluate the result on the test set.	github	industrial
in standard generative adversarial network (sgan), the discriminator estimates the probability that the input data is real.	github	industrial
### running automated tests ## disabling test execution we also provide [pre trained models](#pre trained models and examples) for several benchmark default to the standard output, which you can redirect to a file.	github	industrial
and improves productivity by making asynchronous code simpler and more readable.	github	industrial
when writing unit tests it is often useful to bypass encapsulation and therefore powermock includes several features that simplifies reflection specifically useful for testing.	github	industrial
> this functionality exists because the android studio default logcat view only shows the output for the # pass feedback about performance (and termination) to the agent also, if the progress of your background task cannot be easily measured you might prefer to use an indeterminate progress indicator.	github	industrial
for running all tests write down: test your dejavu settings on a corpus of audio files on a number of different metrics: brickhouse covers a wide range of functionality, grouped in the you are welcome to submit your benchmark; simply create a new issue and we\\\'ll list your results here.	github	industrial
to test on an image or a folder of images (```$path_img```), you can simply do the following: transformer xl achieves new state of the art results on multiple language modeling benchmarks.	github	industrial
mvn clean test p benchmark pl vavr benchmark a couple observations on stress tests there are many implementations of sorts in the java standard library that are much better for performance reasons.	github	industrial
the test framework gives your blockstack look at the output of your cmake call.	github	industrial
as a community, we no longer hand engineer our mapping functions, and this work suggests we can achieve reasonable results without hand engineering our loss functions either.	github	industrial
the pulltorefreshlistview replaces a standard listview widget.	github	industrial
title = {{mmdetection}: open mmlab detection toolbox and benchmark}, **server (collector)** : save the performance metrics from scouter agents or telegraf.	github	industrial
and release builds you should run all tests using the target java version.	github	industrial
pyshark supports automatic decryption of traces using the wep, wpa pwd, and wpa psk standards (wpa pwd is the default).	github	industrial
### compile and test, build jars * **continuous deployment** build and test with jenkins, provision a new aws cluster, turn on some traffic with the load balancer, and roll forth or roll back based on newrelic app performance data.	github	industrial
miasm comes with a set of regression tests.	github	industrial
none are required for a fully functional vpn server.	github	industrial
## help support spyder, the community developed scientific ide!	github	industrial
is in the "a top down method for performance analysis and counter architecture" only use on sites you control for educational purposes.	github	industrial
* functional updates will be reflected in the 3rd number of the version, for example, the next version of 0.1.0 will be 0.1.1. we develop software since 2009, and we\\\'re known experts in this field.	github	industrial
b\'# tracking progress in natural language processing what is particularly worrying about this process is that it is a network linked secure boot process where centralized external servers have the power to dictate what the device should boot.	github	industrial
everything is organized in a fashion that is cohesive to the penetration testing execution standard (ptes) and eliminates a lot of things that are hardly used.	github	industrial
this access is direct and high performance, yet also wrapped in a type safe wi fi diagnostics) will require root privileges for full functionality.	github	industrial
will use tst2012 as our dev dataset, and tst2013 as our test dataset.	github	industrial
for security professionals and researchers only.	github	industrial
### running the integration tests using bats for more control over the remote download domain and local download directory, see how to use [`magnitudeutils.download_model`](#utils).	github	industrial
on grpc for better performance and provide idiomatic client surface for zappa does not intend to conform to pep8, isolate your commits so that changes to functionality with changes made by your linter.	github	industrial
for efficiency, ycm only fetches ultisnips snippets in specific scenarios like | integrity checks and tests | | | | | performance metrics are not available, but you can view some "stress test" examples for the example endpoints.	github	industrial
you do that with standard modern python types.	github	industrial
it is generally used to measure the execution time of snippets.	github	industrial
the reality is that many standard frameworks make this recommend to put the images on a ssd for possible better training performance for newer versions, the bundled `ntfsea` library provides functionality to write the ntfs extended attributes required for voifs, and as such, extraction now happens without the involvement of wsl.	github	industrial
> # some justified output a novel sequence to sequence framework utilizes the **self attention mechanism**, instead of convolution operation or recurrent structure, and achieve the state of the art performance on **wmt 2014 english to german translation task**.	github	industrial
install package and test dependencies: record performances, and things you done that works, and things that are not.	github	industrial
* test a code to see if it is a valid sequence * set `java_home` to point to jdk you want to test against (should be compatible with the version you set in [gradle.properties](gradle.properties)).	github	industrial
for every building blocks, we include a test function in the each file below, and we\\\'ve test each small piece successfully.	github	industrial
the ycmd test directory.	github	industrial
this will setup the app in a virtual environment and run the included test app (`app.py`) immediately on port `8080`.	github	industrial
ignite automatically controls how data is partitioned, however, users can plug in their own distribution (affinity) functions and collocate various pieces of data together for efficiency.	github	industrial
also, we study the quantitative and visual performance of wgan div on standard image synthesis benchmarks, showing the superior performance of wgan div compared to the state of the art methods.	github	industrial
to run the tests first install the development dependencies via: it should take only **one example** to demonstrate the power and flexibility of the windowgram.\\r [ ] front end tests.	github	industrial
**(untested)** the following is based on a standard ubuntu image provided by `dreamhost`, but should work on any linux distribution **without** docker installed and running under **non root** user (e.g.	github	industrial
### installation and tests this functionality requires the to test a model put your blurry images into a folder and run: **_parlaidialogteacher_**: a teacher that implements a simple standard text format for many tasks (non visual tasks only) standard slide featuring a title, short description and image like google\\\'s intros.	github	industrial
this helps prevent a many to one mapping from the latent code to the output during training, also known as the problem of mode collapse, and produces more diverse results.	github	industrial
code is passed via standard input.	github	industrial
* `benchmark`: quickly iterate through the resolutions to measure the raw training performance.	github	industrial
using the pairwise ordering will not remove any functionality form these implementations, but in most it can be used to simulate a heavy load on a server, group of servers, network or object to test its strength or to analyze overall performance under different load types.	github	industrial
* role based access control.	github	industrial
 fused kernels that improve the performance and numerical stability of `apex.parallel.syncbatchnorm`.	github	industrial
the max value, *max_gradient_norm*, is often set to a value we evaluate on stl 10 and pascal datasets, where our approach obtains performance comparable or superior to existing methods.	github	industrial
we decided to go open source after reaching 100% test coverage.	github	industrial
simple example showing some basic functionality ideally training and validation should be separate, where the model is loaded every time to test on validation.	github	industrial
newly installed systems can also just add a standard account.	github	industrial
data management system that provides reliable asynchronous event notifications #### for standard sizes start format string with: ### using shared data for performance and simplicity.	github	industrial
under this model, it has a test function, which ask this model to count numbers both for story(context) and query(question).	github	industrial
and to imporove performance by increasing weights of these wrong predicted labels or finding potential errors from data.	github	industrial
in terms of speed, we test the inference speed of both cornernet and centernet on a nvidia tesla p100 gpu.	github	industrial
 train and test the network using the training shell script each line will contain output for each sample, columns are the our proposed method encourages bijective consistency between the latent encoding and output modes.	github	industrial
the main reason for this is source control and collaboration: when looking at the changes of a commit, it is much easier to identify what sentence was changed if they are each on their separate line.	github	industrial
many scientific algorithms can be expressed in terms of large matrix the test settings can be set by updating the ```test``` section of the configuration file (see the ```configs``` folder for examples).	github	industrial
 open source means: no backdoors, control is better than trust test with pre trained resnet101 models the zappa asynchronous functionality only works to make sure everything works fine, test the model on the following conversation they do not contain package managers, shells or any other programs you would expect to find in a standard linux distribution.	github	industrial
that\'s it, then feel free to add more integration test for the dubbo project.	github	industrial
it\\\'s needed for the unit tests which are run during a build.	github	industrial
please note that powermock is mainly intended for people with expert knowledge in unit testing.	github	industrial
more control over the build process.	github	industrial
it\\\'s important to **benchmark** and **profile** to simulate and uncover bottlenecks.	github	industrial
research project focused on improving the performance of remotely sensed tree surveys.	github	industrial
hotswap performance can be improved using an experimental option ` xx:hotswapdeoptclasspath=`.	github	industrial
vert.x has a few integrations tests that run a differently configured jvm (classpath, system properties, etc....) ### running tests of the postgres connector against an external database, e.g.	github	industrial
* the load balancer can become a performance bottleneck if it does not have enough resources or if it is not configured properly.	github	industrial
write code and test code and pull request.	github	industrial
at present, uetool provides functionality as follows: this uses performance counters in the cpu.	github	industrial
 **agent** : gather performance information and send to the server the physical web must be an open standard that everyone can use.	github	industrial
useful for benchmarking.	github	industrial
initially conceived by the network engineering team at they should also be reasonably optimized for fast performance while still being easy to read.	github	industrial
we\\\'re working on improving that experience or providing alternatives that give more fine tuned control.	github	industrial
should you encounter any bugs, glitches, lack of functionality or maven is not required (anymore) to develop portfolio performance as you can develop using the eclipse ide with the setup above.	github	industrial
to obtain the test set result using the best chosen hyperparameter from cv, run the following: unfortunately there are no current plans to make any changes to this project in the near future, and it is not being maintained or updated.	github	industrial
the `phonenumbermatcher` object provides the relevant functionality; you can iterate over it to retrieve a this behavior has "chain reaction" effects among apps with similar sdks, greatly aggravating the overall device performance.	github	industrial
the chat bots can even scrape the internet for information to return in their output as well as to use for learning.	github	industrial
to learn how to use distributedlog to build your reliable real time services.	github	industrial
runs the tests nowadays, centralized cloud providers are in control of these services, these platforms are constrained by closed networks, proprietary payment systems, and hard coded provisioning operations.	github	industrial
this can add a *human touch* to the output; it feels like you\\\'re the writer!	github	industrial
this specialization has in turn made it critical to have a reliable and scalable data pipeline that can capture these changes happening for primary source of truth systems and route them through the rest of the _a logical, reasonably standardized, but flexible project structure for doing and sharing data science work._ in the case of apple hardware and the use of efi, apple stores relevant information within efi to aid in the functionality of macos.	github	industrial
but when you want to maximize performance, you can often use `jit` in your own accepts both standard text and numeric logging values.	github	industrial
tcp is useful for applications that require high reliability but are less time critical.	github	industrial
photon\\\'s smart thread management & refined logic gives you top notch performance.	github	industrial
it is is also captured in audit logs for integrating with external logging and analytical tools: logstash, splunk, statsd, syslog.	github	industrial
mycat s target is to smoothly migrate the current stand alone database and applications to cloud side with low cost and to solve the bottleneck problem caused by the rapid growth of data storage and business scale.	github	industrial
train (and test, evaluation) we designed elastalert to be reliable, highly modular, and easy to set up and configure.	github	industrial
test software performance under resource constraints moreover, writting unit tests becomes easier because the viewmodels are decoupled from the view.	github	industrial
> "asgi is going to enable all sorts of new high performance web services.	github	industrial
* **full control** over queries, transaction and object mapping 4) how can we become expert in a specific of machine learning?	github	industrial
the output is consistent with the output of ```basesvc.decision_function``` when the `decision_function_shape` is set to `ovo`.	github	industrial
* wireless social engineering to run all the tests please execute the following command from the project root folder: like solr itself, the test running can be customized or tailored in a number or you can check the solution executing tests inside tests directory.	github	industrial
bidirectionality on the encoder side generally gives better performance (with the base visidata package concerns loaders whose dependencies are covered by the python3 standard library.	github	industrial
to run the integration tests of the pg connector using wal2json, enable the "wal2json decoder" build profile: once you\\\'ve got a phone number, a common task is to format it in a standardized format.	github	industrial
it doesn t include any personal information and it s used to measure the effectiveness of a promotional campaign.	github	industrial
for more information about the other functionality available from the library, look in the unit tests or in the original it is build on placeholderview and adds the functionality of handling load more views when the user has scrolled to the bottom of the list.	github	industrial
### how is the model performance measured?	github	industrial
if you need further control on how to add paths to `sys.path`, you should define most results can be copied and pasted wherever you like, since they use standard block characters.	github	industrial
 the differences in the output of `g1` and `g2` in the second part is due the way variables `array_1` and `array_2` are re assigned values.	github	industrial
availability, improved performance, scalability, and fault tolerance.	github	industrial
each model has a test method under the model class.	github	industrial
 [steps to implement pagination functionality into tableview](#steps to implement pagination functionality into tableview) the subdirectories contain sample implementations and tests for different drqa\\\'s performance improves significantly in the full setting when provided with distantly supervised data from additional datasets.	github	industrial
* **write user test scenarios in plain old python**<br> i basically wrote the whole library in a rush, without tests, while being a serious expert beginner at the time.	github	industrial
the algorithms performance.	github	industrial
this functionality is enabled by default when the tool is launched.	github	industrial
secondly, we will do max pooling for the output of convolutional operation.	github	industrial
to combine test data from all tasks into a single test set, use if you use this toolbox or benchmark in your research, please cite this project.	github	industrial
hides the complexity of performance and functional tests with an automation friendly convenience wrapper.	github	industrial
this is a collection of algorithms and data structures which i\\\'ve implement over the years in my academic and professional life.	github	industrial
or controlling the output compression of a tiff file.	github	industrial
also, when running the tests, make sure that the cuda profiling tools interface (cupti) can be found, e.g.	github	industrial
undebt lets you define complex find and replace rules using standard, straightforward python that can be applied quickly to an entire code base with a simple command.	github	industrial
numpy is a generic framework for scientific computing; it does not testing scripts to confirm functional correctness of the code architecture to deliver fail safe reliability and performance.	github	industrial
this\\\'s the the performance of material style in support package v19.	github	industrial
to run all the jax tests, we recommend using `pytest xdist`, which can run tests in with *anaconda* and other scientific python distributions, so you don\'t need in some extent, the difference of performance is not so big.	github	industrial
evaluate your performance in one line: architectures, sgd with scheduling will generally lead to better performance if small performance enhancement for multithreadclaimstrategy.	github	industrial
because of performance issue those queue is processed in separate thread, this is required due to blocking nature of all above operations.	github	industrial
display the output of individual modules in one or more web browser instances.	github	industrial
that means we can quickly audit their behavior and remove them if they request access to information they shouldn\\\'t (why would an ad blocker require camera access?).	github	industrial
### completion doesn\\\'t work with the c   standard library headers that said, yes the performance isn\\\'t as good as the sharedpreferences.	github	industrial
this document aims to track the progress in natural language processing (nlp) and give an overview is to provide the reader with a quick overview of benchmark datasets and the state of the art for their powerful, flexible [**group by**][groupby] functionality to perform reliability by using multi threaded amazon s3 multipart calls.	github	industrial
> the introduction of these coprocessors to mac devices, while increasing security in many ways, brings with it all the issues with ios discussed above, and means that running mac devices securely with complete user control, and without forced network interaction with the apple mothership in highly sensitive corporate and other environments problematic and risky.	github	industrial
this task acts as a regularizer for standard supervised training of the discriminator.	github	industrial
