sentence	provenance	convention
udp is less reliable but works well in real time use cases such as voip, video chat, streaming, and realtime multiplayer games.	github	industrial
the precision x recall curve is a good way to evaluate the performance of an object detector as the confidence is changed by plotting a curve for each object class.	github	industrial
to test the model: a **distributed transaction solution** with high performance and ease of use for **microservices** architecture.	github	industrial
as a result, they fail to generate diverse outputs from a given source domain image.	github	industrial
* support the padding, and the subsequent slide down on plans to join, so no longer support contentitem margin properties.	github	industrial
in this project, two benchmarks are exploited for evaluation.	github	industrial
productivity, and the scalability and robustness of hive queries.	github	industrial
point, please email the resulting output to samuel clay at with cyclops map and other functional operations become lazy, and the your chain of commands are only executed when data within the collection is exected for the first time.	github	industrial
this guide is targeted to power users who wish to adopt enterprise standard security, but is also suitable for novice users with an interest in improving their privacy and security on a mac.	github	industrial
the perplexity on the test sets of penn treebank corpora.	github	industrial
**: unlike other libraries and tools which either give a nice output or fail miserably (with no in between), camelot gives you the power to tweak table extraction.	github	industrial
all unit tests in baselines can be run using pytest runner: understandability: deep learning model internals are often considered black boxes, but we provide standard visualizations to understand their performance and compare their predictions.	github	industrial
more generally, the `dnc` class found within `dnc.py` can be used as a standard this functionality can be implemented in software or hardware, running in an appliance device, or in a typical server running a common operating system.	github	industrial
for this model can use normal python flow control to implement the loop, and we engineers and ux designers at google, these components enable a reliable to package up a new jar file without running the tests: if you want to restrict the entry of ips to the current client ip using an automatically populated drop down, create a standard user account using the `account creator.sh` script located in the `auth` directory, which will prompt you for the input and create the user account.	github	industrial
> ios has from the start been designed with very little end user control with no way for end users to configure devices according to their wishes while maintaining security and relies heavily on new, closed source code.	github	industrial
this is achieved while using a relatively simple model architecture and a standard training procedure.	github	industrial
"**continuous control with deep reinforcement learning**."	github	industrial
hive provides standard sql functionality, including many of the later switch to hdrhistogram for latency measurement ignite allows you to control how many instances of your service should be deployed on each cluster node and will benchmarking and profiling might point you to the following optimizations.	github	industrial
write a test which shows that the bug was fixed or that the feature works as expected.	github	industrial
for efficiency, ycm only fetches ultisnips snippets in specific scenarios like in this project, two benchmarks are exploited for evaluation.	github	industrial
you can disable all tests by skipping the `test` task: note that by default, only the vanilla hadoop tests are running you can enable additional tests (such as hive or pig) by adding the tasks non reuse (linearity) is not yet checked.	github	industrial
some benchmark scripts.	github	industrial
state of the art results are achieved on challenging benchmarks.	github	industrial
if you need more control of write parameters and the writing process, the common idiom for writing is something like: delivering applications to users, also for (interactive) scientific these tests may take as much as half an hour to complete.	github	industrial
## quick start: test on an image using our trained model immediacy of real time chat with the productivity benefits of threaded a test suite is also present to complement the functional testing.	github	industrial
thank you for your interest in logback, the reliable, generic, fast patator is a multi threaded tool written in python, that strives to be more reliable and flexible than his fellow predecessors.	github	industrial
the benchmarks shown are actual screenshots taken from a 2nd gen moto x.<sub>* it first use one layer mlp to get uit hidden representation of the sentence, then measure the importance of the word as the similarity of uit with a word level context vector uw and get a normalized importance through a softmax function.	github	industrial
while we try to provide the best possible xmpp library for android and java se compatible execution environments by following state of the art software engineering practices, the api may not always perfectly fit your requirements.	github	industrial
when the inverse is true, where there are many more outputs than inputs, reverse mode is not an efficient algorithm, as it has to be run as many times as there are output variables.	github	industrial
* ` world`, set the max channel to 13. in n. america the max channel standard is 11, but the rest of the world uses 13 channels so use this option if you\\\'re not in n. america it excels at transforming transactional and relational datasets into feature matrices for machine learning using reusable feature engineering "primitives".	github	industrial
remote calls are usually slower and less reliable than local calls so it is helpful to distinguish rpc calls from local calls.	github	industrial
you want compiled control flow, use structured control flow primitives like the most interesting part is a feature rich, persistent collection library that smoothly integrates with java\\\'s standard collections.	github	industrial
if you use this toolbox or benchmark in your research, please cite this project.	github	industrial
tensorlayer has extensive documentation for both beginners and professionals.	github	industrial
incorporating our strong expertise in building recurrent and seq2seq models fast & reliable you don\\\'t have to be a machine learning expert to add recommendations, object detection, image classification, image similarity or activity classification to your app.	github	industrial
trends in the configured output for anything you want to measure from your logs.	github	industrial
* ` keepall`: use this flag when training if when testing, you want to see the predictions at different steps (it can be interesting to see the program changes its name and age as the training progress).	github	industrial
this allows ease of use for novices and flexibility for experts.	github	industrial
### benchmark results #### i need professional support with conversations or setting up my server some databases offer apis or frameworks for monitoring changes, but there is no standard so each database\\\'s approach is different and requires a lot of knowledged and specialized code.	github	industrial
we believe that it is important to provide benchmarks that people can easily for example, some teams would like to enforce additional tagging standards apart from the global standards set for all of the cloud.	github	industrial
take the control of the flow graph by inverting conditional jumps: control the same concepts if the user has those set.	github	industrial
to select the cpus to measure.	github	industrial
now you can control the slide of the view, just use the method expand() when you want.	github	industrial
>>> ord(\\\'e\\\') # latin \\\'e\\\', as used in english and typed using standard keyboard library for the oauth 1.0a and oauth 2.0 authorization standards.	github	industrial
you should understand this context in order to manage the system performance efficiently.	github	industrial
when training context encoders, we have experimented with both a standard pixel wise reconstruction loss, as well as a reconstruction plus an adversarial loss.	github	industrial
the application is still reliable.	github	industrial
**ssh audit** is a tool for ssh server auditing.	github	industrial
"[engineering the next generation of cloud the following **has not been tested** and is based on a standard ubuntu image provided by `microsoft azure` using `cloud harness` automation tool i wrote a while back and assumes an empty `microsoft azure` subscription.	github	industrial
least likelihood of potential pitfalls for non experts, and we may be make socket communication more beautiful, suitable for large, medium and small project, the rapid development of stable, maintainable, reliable socket connection.	github	industrial
modules from the standard library you have to load a single javascript file this makes the training set too "easy" which causes the model to perform worse on other benchmarks.	github	industrial
disable cudnn for batch_norm: standard folder layout: *useful cli based tools for productivity.	github	industrial
apache curator includes a high level api framework and utilities to make using apache zookeeper much easier and more reliable.	github	industrial
its objectives include effective levels of decoupling between devices and applications, designed to keep markets open and encourage the rapid growth of scalable web and enterprise middleware and applications.	github	industrial
* [denormalize](#denormalization) where performance demands it.	github	industrial
measure whole system in level 2 while program is running training progress will be displayed in the console, but tensorboard can also be used.	github	industrial
we also apply the proposed framework to domain adaptation and achieve state of the art performance on benchmark datasets.	github	industrial
`dubbo spring boot starter` is a standard spring boot starter, which contains [dubbo spring boot autoconfigure](dubbo spring boot autoconfigure) and [dubbo spring boot actuator](dubbo spring boot actuator).	github	industrial
* reliable text based **"record replay"** generator is also a high priority feature under development.	github	industrial
professional services ## help support spyder, the community developed scientific ide!	github	industrial
we here at blueline labs tend to use either mvp or mvvm, but it would work equally well with standard mvc or whatever else you want to throw at it.	github	industrial
denormalization attempts to improve read performance at the expense of some write performance.	github	industrial
once connected it can trace your application code, 3rd party modules and modules that are part of the erlang standard libary.	github	industrial
the ability to capture data packets they send is very dependent on physical proximity and the power of your network card.	github	industrial
* v. akbarzadeh, c. gagn , m. parizeau, m. argany, m. a mostafavi, "probabilistic sensing model for sensor placement optimization based on line of sight coverage", accepted in ieee transactions on instrumentation and measurement, 2012.	github	industrial
* readability of test cases is greatly improved, compared to standard instrumentation tests.	github	industrial
for more information, including future plans for an open source license, please see the file `windowgram.py`.\\r below is the level 2 toplev measurement of a linux kernel compile.	github	industrial
figure: training progress of a regularized polynomial regression model fitting <br> to a normalized output (one column for each event).	github	industrial
object that is similar to the standard websocket object but websock load less annotations to accelarate training progress.	github	industrial
 focused on reducing the memory usage with the result that the peak memory usage on various benchmarks nearly halved.	github	industrial
it has been proven quite reliable on a great number of them.	github	industrial
learning how to design scalable systems will help you become a better engineer.	github	industrial
robotium makes it easy to write powerful and robust automatic black box ui tests for android applications.	github	industrial
* jpegs using non standard color spaces, unsupported by java 2d this allows ease of use for novices and flexibility for experts.	github	industrial
capabilities of a scientific package.	github	industrial
it excels at transforming transactional and relational datasets into feature matrices for machine learning using reusable feature engineering "primitives".	github	industrial
also, we study the quantitative and visual performance of wgan div on standard image synthesis benchmarks, showing the superior performance of wgan div compared to the state of the art methods.	github	industrial
* toplev has a new summary option to print the summary of the complete measurement session these extensions are standardized as well in so called designed for distributing, indexing, and analyzing the data generated during a security audit.	github	industrial
the lower levels of the measurement tree are less reliable [x] **add layer normalization rnn for efficiency** (2017 08 06) as a result cqrs applications are usually more complicated, especially when they need to ensure reliable and totally ordered processing.	github	industrial
the new version provides plenty features for convenient usage and efficiency improvement.	github	industrial
use memory to track state of world; and use non linearity transform of hidden state and question(query) to make a prediction.	github	industrial
we report the benchmarks with resnet 50 backbone as below.	github	industrial
measurement errors with non steady state workloads you don\\\'t have to be a machine learning expert to add recommendations, object detection, image classification, image similarity or activity classification to your app.	github	industrial
4) how can we become expert in a specific of machine learning?	github	industrial
we propose an alternative to clipping weights: penalize the norm of gradient of the critic with respect to its input.	github	industrial
### company engineering blogs by the global norm.	github	industrial
for input processing, we used the raw 1 billion word benchmark dataset reliable _real time_ applications.	github	industrial
the glyphs are designed based on this "plan"; most stems and lines will be positioned at em units that are even multiples of 128, and in a few cases they are at even multiples of 64 or as low as 16. applications that don\\\'t need or want this level of fault tolerance, performance, scalability, and reliability can instead use debezium\\\'s *embedded connector engine* to run a connector directly within the application space.	github	industrial
figure: training progress of a generative adversarial network generating <br> one of the main challenges when building a research project, or a solution based on a published algorithm, is getting a concrete and reliable baseline that reproduces the algorithm\\\'s results, as reported by its authors.	github	industrial
| [available models] | detailed model descriptions, accuracy figures and benchmarks.	github	industrial
developers now have greater control over how their applications are deployed across clusters of resources, run and scale in production, and can take advantage of powerful placement capabilities of amazon ecs.	github	industrial
conditional generative adversarial networks (gans) for cross domain image to image translation have made much progress recently.	github	industrial
i am not an expert in mathjax.	github	industrial
there is a set of sample penn tree bank (ptb) corpus in `data` directory, which is a popular benchmark for measuring quality of these models.	github	industrial
note that the input images to the model need to be standardized using fixed image standardization (use the option ` use_fixed_image_standardization` when running e.g.	github	industrial
jctools is benchmarked using both jmh benchmarks and handrolled harnesses.	github	industrial
measure whole system for x seconds every 100ms, outputting in csv format.	github	industrial
 raschka, sebastian (2018) mlxtend: providing machine learning and data science utilities and extensions to python\'s scientific computing stack.	github	industrial
alone, you can rapidly build and test more reliable models.	github	industrial
* **alibaba cloud schedulerx** accurate, highly reliable, and highly available scheduled job scheduling services with response time within seconds.	github	industrial
>written by three experts in the field, deep learning is the only comprehensive book on the subject."	github	industrial
the table below collects the submitted benchmarks.	github	industrial
track training progress in tensorboard: ## chinese word analogy benchmarks visdom aims to facilitate visualization of (remote) data with an emphasis on supporting scientific experimentation.	github	industrial
full power of the python language.	github	industrial
lj speech dataset is recently widely used as a benchmark dataset in the tts task because it is publicly available.	github	industrial
we propose an alternative to clipping weights: penalize the norm of gradient of the critic with respect to its input.	github	industrial
 the core control flow has been rewritten, which fixes several performance and reliability issues about adapter and async content support.	github	industrial
1) performance benchmarking focus was on improving language compatibility to the point that we can start running "real code" in the form of existing benchmarks.	github	industrial
independent techempower benchmarks show starlette applications running under uvicorn **on december 12th, a facebook engineer commented that they are developing a new endpoint for scraping posts chronologically.	github	industrial
we introduce a method for training gans with discrete data that uses the estimated difference measure from the discriminator to compute importance weights for generated samples, thus providing a policy gradient for training the generator.	github	industrial
xxl api is a powerful and easy to use api management platform that provides "management", "documentation", "mock", and "test" functions for the api.	github	industrial
b\'# stash shell like an expert in pythonista * top statistics on home page with configurable duration and measurement metric.	github	industrial
golem is a decentralized marketplace for computing power.	github	industrial
the normalized version, `nem`, lowercases and strips punctuation all of our models are trained on lowercased data, so `nem` is a more accurate representation of performance than `em` for our models.	github	industrial
### how is the model performance measured?	github	industrial
maintain them and have no plan to support them in the foreseeable future.	github	industrial
and, finally, there is no reliable tool to properly resolve dependencies in python, so i started `poetry` the paho project has been created to provide reliable open source implementations of open and standard messaging protocols aimed at new, existing, and emerging applications for machine to machine (m2m) and internet of things (iot).	github	industrial
* string prefixes are now standardized to lowercase and `u` is removed the ultimate goal of automl is to provide easily accessible deep learning tools to domain experts with limited data science or machine learning background.	github	industrial
this document aims to track the progress in natural language processing (nlp) and give an overview * productivity tools you don\\\'t have to be a machine learning expert to add recommendations, object detection, image classification, image similarity or activity classification to your app.	github	industrial
mark brought many great ideas into the life using power of python.	github	industrial
initially conceived by the network engineering team at clipped_gradients, _ = tf.clip_by_global_norm( <h4 align="center">open source application designed to load test applications and measure performance.	github	industrial
* national science and engineering research council of canada (nserc), rapidoid is an extremely fast http server and modern java web framework / application container, with a strong focus on high productivity and high performance.	github	industrial
generative adversarial networks (gans) are a learning framework that rely on training a discriminator to estimate a measure of difference between a target and generated distributions.	github	industrial
* scan faster and more reliable, now can brute up to 3000 domains per second ideally, in order to have trustworthy benchmarking among different approaches, it is necessary to have a flexible implementation that can be used by everyone regardless the dataset used.	github	industrial
simple methods like average and max pooling of the word level elmo representations across sentences works well, often outperforming supervised methods on benchmark datasets.	github	industrial
clip gradients to this norm [50] spyder is a powerful scientific environment written in python, for python, its objectives include effective levels of decoupling between devices and applications, designed to keep markets open and encourage the rapid growth of scalable web and enterprise middleware and applications.	github	industrial
 powerful helper functions to train any tensorflow graph, with support of multiple inputs, outputs and optimizers.	github	industrial
participants of the competition can use the provided matlab script to measure the accuracy of their detections before submitting their results.	github	industrial
please note that my explanations of the effects may not in fact be accurate or deeply scientific.	github	industrial
the metrics to measure in a fine grained way.	github	industrial
you can replace mysql with cobar to power your application.	github	industrial
it first use one layer mlp to get uit hidden representation of the sentence, then measure the importance of the word as the similarity of uit with a word level context vector uw and get a normalized importance through a softmax function.	github	industrial
figure: training progress of a regularized polynomial regression model fitting <br> *a fast and reliable distributed task processing library for python 3. network connection class currently only measures the user\\\'s downstream bandwidth.	github	industrial
convenient & efficient and better performance for java microservice full stack.	github	industrial
a reliable, flexible, fast and powerful download engine.	github	industrial
the glyphs are designed based on this "plan"; most stems and lines will be positioned at em units that are even multiples of 128, and in a few cases they are at even multiples of 64 or as low as 16.	github	industrial
* 27.01.2014: added benchmarking, bug fixing thanks to [dr emann][9] as mentioned before, there are two different ways to measure the interpolted average precision: **11 point interpolation** and **interpolating all points**.	github	industrial
| `misc.professions` | calling jobs by the right name | non linearity transform of query and hidden state to get predict label.	github	industrial
we built an automatic benchmarking system based on `scikit learn` that covers 129 classifiers (but no deep learning) with different parameters.	github	industrial
mycat s target is to smoothly migrate the current stand alone database and applications to cloud side with low cost and to solve the bottleneck problem caused by the rapid growth of data storage and business scale.	github	industrial
* an organisation\\\'s name, searching via linkedin switch to hdrhistogram for latency measurement _a logical, reasonably standardized, but flexible project structure for doing and sharing data science work._ our deep residual network is able to recover photo realistic textures from heavily downsampled images on public benchmarks.	github	industrial
an important goal is to provide excellent support for non java based developers to be productive using spring hadoop ignite community plans to implement sql transactions in version 2.2.	github	industrial
* reliable asynchronous event notifications and guaranteed message delivery the paho project has been created to provide reliable open source implementations of open and standard messaging protocols aimed at new, existing, and emerging applications for machine to machine (m2m) and internet of things (iot).	github	industrial
results of benchmarks on mujoco (1m timesteps) and atari (10m timesteps) are available you don\\\'t have to be a machine learning expert to add recommendations, object detection, image classification, image similarity or activity classification to your app.	github	industrial
for experts, start with a completely fresh (really, i mean it) ubuntu 18.04 lts 64 bit machine.	github	industrial
they must also be aware of approaches and practices recommended by experienced industry experts to ensure every use of ai brings overall benefit to mankind.	github	industrial
*useful cli based tools for productivity.	github	industrial
sentence level vector is used to measure importance among sentences.	github	industrial
b\'pulsar is a highly scalable and reliable event driven data pipeline for real time analytics.	github	industrial
participants of the competition can use the provided matlab script to measure the accuracy of their detections before submitting their results.	github	industrial
* mycat behind a strong technical team whose participants are experienced more than five years including some senior software engineer, architect, dba, etc.	github	industrial
mindsdb\\\'s goal is to give developers easy access to the power of artificial neural networks for their projects.[!	github	industrial
